{
  "version": "1.0",
  "canonical_file": "Coding_Project_Governance_v1.0.md",
  "canonical_sha256": "04cd33bbaff66f44917199e6bbb8355a1e956edb9c474e6c8e664ed8d0ed41c1",
  "generated_at": "2026-07-11T19:35:37Z",
  "generator": "build_generic_policy.py@1.0",
  "authoritative_files": [
    "Coding_Project_Governance_v1.0.md"
  ],
  "derived_files": [
    "Coding_Project_Governance_v1.0_Compact.md",
    "Coding_Project_Governance_v1.0.docx",
    "ChatGPT_Project_Bootstrap.template.md",
    "Project_Profile.template.yaml",
    "Project_Extension.template.md",
    "policy_machine.v1.0.json",
    "Enforcement_Checklist.md",
    "Lessons_Learned.md",
    "Migration_Guide_DS_MCP_to_Generic.md",
    "RedTeam_ReReview.md"
  ],
  "support_files": [
    "approval_envelope.schema.json",
    "change_plan.schema.json",
    "project_profile.schema.json",
    "project_extension.schema.json",
    "policy_manifest.schema.json",
    "enforce_coding_policy_v1_0.py",
    "build_generic_policy.py"
  ],
  "project_profiles": [
    "projects/rental-home/project-profile.yaml",
    "projects/ds-mcp/project-profile.yaml",
    "projects/pm-skills/project-profile.yaml"
  ],
  "critical_rule_ids": [
    "TRUST-01",
    "TRUST-02",
    "TRUST-03",
    "TRUST-04",
    "TRUST-06",
    "GATE-01",
    "GATE-02",
    "GATE-03",
    "GATE-04",
    "GATE-05",
    "PROFILE-01",
    "PROFILE-02",
    "PROFILE-03",
    "PROFILE-04",
    "PRE-02",
    "PRE-03",
    "PRE-04",
    "PRE-05",
    "GH-02",
    "GH-03",
    "CMD-01",
    "CMD-02",
    "CMD-03",
    "CMD-04",
    "CMD-05",
    "DATA-01",
    "DATA-02",
    "DATA-03",
    "SEC-01",
    "SEC-02",
    "VAL-04",
    "VAL-05",
    "PR-02",
    "CI-01",
    "CI-02",
    "CI-03",
    "CI-04",
    "CI-05",
    "POLICY-01",
    "POLICY-02",
    "POLICY-03",
    "POLICY-04",
    "POLICY-05",
    "BAN-01"
  ],
  "file_sha256": {
    "Coding_Project_Governance_v1.0.md": "04cd33bbaff66f44917199e6bbb8355a1e956edb9c474e6c8e664ed8d0ed41c1",
    "Coding_Project_Governance_v1.0_Compact.md": "31b9662d768e428fa8c3f6d6f980b228737a6a6292a2879d6aacaf47e2df739b",
    "Coding_Project_Governance_v1.0.docx": "08daf5c58b940b618118b30beb651b507739927a2f9160edc5c0ba75933eb2ed",
    "ChatGPT_Project_Bootstrap.template.md": "24c5645c846c9f60e78e36b7d18edec5f7c6e4960859a0ced521d03397bce011",
    "Project_Profile.template.yaml": "53505c829f3d5c7deac80fd84fd871c040b5b971545b4475baccc24cbd4e690c",
    "Project_Extension.template.md": "3338a17d02516f41566a5c57843e09263761cf08d3089c93fdf1d62f77d8a43c",
    "policy_machine.v1.0.json": "29882945f3ee8dfb6723aac1aca4d51b7e3395bc2c0ce886d9e90e09d2d55e83",
    "Enforcement_Checklist.md": "d7582de494e88aaafbcb6c10a94a48f0d5879663570ede88e25b11cb5cdd2ad1",
    "Lessons_Learned.md": "c752ba52a2174c2c4f6b82f9a53c0ec93d3b16c7f620c605ace238e8fd4e05ed",
    "Migration_Guide_DS_MCP_to_Generic.md": "d9d6ea4698a1df3bd59438dfc5c3ed0677f8aa17a1b0d9ee6bf9afe3219ed3df",
    "RedTeam_ReReview.md": "14b7d53d66dfd9f7cdf7ee4cddca5bc42e32dcb691da9b473519a542ea9aef1a",
    "approval_envelope.schema.json": "c2c369fd0a5efa90d6170d68f845b8a12ebc2982f3f729d36b1feb514908f749",
    "change_plan.schema.json": "84ef8c6e20c2a46fcd11f80f61c849e00493b4e68def2b272574c9ed908e85d1",
    "project_profile.schema.json": "b1e634a4c3854669b746124590be31353f3a7e3cb4f44f753c045f786c14db8b",
    "project_extension.schema.json": "7a0342875b20803b5b4632731bdea97e1bcd46fc68d0530ae9429fc07cce0ac6",
    "policy_manifest.schema.json": "75ea6e13bd60cf753cf70de4b60a81864796c6faad5503d3526f547807a0fea1",
    "enforce_coding_policy_v1_0.py": "51c55a40d1607fd85236b85b67c9e9b82ae27a5d11fe2fdf6c02e90b86f7c76f",
    "build_generic_policy.py": "3dcae5affceb80bb5e4e55923910a2bf106614702c34f359bc4dd9be80a138ec",
    "projects/rental-home/project-profile.yaml": "6e84db71e8abcc2291141d873bd3e611cac204d6b965a58a7aaac1c05ff9fd71",
    "projects/rental-home/project-extension.md": "b1f6e8519346db35c81f663dc93909d4057d0ae83e86d114ab0cdca4b25a5bd5",
    "projects/rental-home/chatgpt-bootstrap.md": "e593a8982a8dbc7db907c9e4aa882275ec6c3fc831a46f80a760826185f35662",
    "projects/ds-mcp/project-profile.yaml": "0c4f87fe2e9e20e61b35a65c6dff8d0a23bf357a5289937e48518824a77cec8f",
    "projects/ds-mcp/project-extension.md": "f17a535333b6a62013a3d81ae06aaa0814b4ae731b2c52721ea7d8dbe8e3e27e",
    "projects/ds-mcp/chatgpt-bootstrap.md": "79b323230f1c64e1a02890c150a2785176e744e312414fe9e3edf1e9c7eb24b0",
    "projects/pm-skills/project-profile.yaml": "79743189b9a733a27dc9044f42b205c0ac258862db457879310d6e93e045eeb6",
    "projects/pm-skills/project-extension.md": "0a3093ba7c931236e16fa94367bb4a4e6f9dff978a52a8f83e6f13b7fcb37df4",
    "projects/pm-skills/chatgpt-bootstrap.md": "4389acbf7f347e00e52ff43828617aa48a1592f3ea6885c0cf60df47e2d28d6f"
  }
}
